[
  {
    "source": "dommuseum",
    "source_id": "1127",
    "url": "https://dommuseum.at/260814_WKS_Familie",
    "title": "Familienatelier 3-6 Jahre",
    "start": "2026-08-14T15:00",
    "end": "2026-08-14T16:30",
    "venue": "Dom Museum Wien",
    "district": 1010,
    "city": "Wien",
    "address": "Stephansplatz 6, 1010 Wien",
    "category": "Kinder Workshop",
    "description": "\"Der innere Schweinehund und andere Widerstandswesen\" (mixed media) Nach einem Blick in die Ausstellung \"Alles in Arbeit\" gestalten wir unsere eigenen inneren Schweinehunde, die uns manchmal von der Arbeit abhalten wollen."
  },
  {
    "source": "dommuseum",
    "source_id": "1128",
    "url": "https://dommuseum.at/ArEvent-9",
    "title": "DOMerstagabend",
    "start": "2026-08-27T18:00",
    "end": "2026-08-27T19:30",
    "venue": "Dom Museum Wien",
    "district": 1010,
    "city": "Wien",
    "address": "Stephansplatz 6, 1010 Wien",
    "category": "Rundgang",
    "description": "Finissage / Kuratorinnenführung - Alles in Arbeit Johanna Schwanberg, Direktorin des Dom Museum Wien, führt persönlich ein letztes Mal durch die Ausstellung"
  },
  {
    "source": "dommuseum",
    "source_id": "1129",
    "url": "https://dommuseum.at/260925_WKS_Familie",
    "title": "Familienatelier 3-12 Jahre",
    "start": "2026-09-25T15:15",
    "end": "2026-09-25T17:15",
    "venue": "Dom Museum Wien",
    "district": 1010,
    "city": "Wien",
    "address": "Stephansplatz 6, 1010 Wien",
    "category": "Kinder Workshop",
    "description": "Käfer, Krone, Stephansdom (Gips-Technik) Wir folgen den Spuren von Rudolf dem Stifter und begegnen dabei einem besonderen Käfer, den wir danach im Atelier selbst gestalten."
  },
  {
    "source": "dommuseum",
    "source_id": "1130",
    "url": "https://dommuseum.at/260926_WKS_Familie",
    "title": "Familienatelier 3-12 Jahre",
    "start": "2026-09-26T15:15",
    "end": "2026-09-26T17:15",
    "venue": "Dom Museum Wien",
    "district": 1010,
    "city": "Wien",
    "address": "Stephansplatz 6, 1010 Wien",
    "category": "Kinder Workshop",
    "description": "Käfer, Krone, Stephansdom (Gips-Technik) Wir folgen den Spuren von Rudolf dem Stifter und begegnen dabei einem besonderen Käfer, den wir danach im Atelier selbst gestalten."
  },
  {
    "source": "dommuseum",
    "source_id": "arbeit-information",
    "url": "https://dommuseum.at/arbeit-information",
    "title": "Alles in Arbeit",
    "start": "2025-10-03",
    "end": "2026-08-30",
    "venue": "Dom Museum Wien",
    "district": 1010,
    "city": "Wien",
    "address": "Stephansplatz 6, 1010 Wien",
    "price_min": 10.0,
    "price_text": "Regulär € 10",
    "category": "Ausstellung",
    "description": "Arbeit ist nicht nur ein politisch brisantes, sondern auch ein existenziell aufgeladenes Thema. Sie durchzieht kulturelle, religiöse und soziale Deutungssysteme – als Norm, Last, Hoffnung und Struktur zugleich. Die Ausstellung rückt das menschliche Ringen mit Erwerbsarbeit in den Mittelpunkt: ihre Notwendigkeit, Sinnhaftigkeit, Zumutung und Gestaltung. Dabei treten auch unsichtbare, unbezahlte oder zu gering bezahlte Tätigkeiten in den Fokus – wie Care-Arbeit, Hausarbeit, künstlerisches Schaffen, Protestformen und selbst Prokrastination."
  }
]
