[
  {
    "source": "hofmobiliendepot",
    "source_id": "made-in-austria",
    "url": "https://www.moebelmuseumwien.at/en/program/events/detail/made-in-austria",
    "title": "MADE IN AUSTRIA. Furniture Design 1948–1960",
    "start": "2026-04-15",
    "end": "2026-12-08",
    "venue": "Vienna Furniture Museum",
    "district": 1070,
    "city": "Wien",
    "address": "Andreasgasse 7, 1070 Wien",
    "price_text": "included in admission",
    "category": "Special Exhibition",
    "description": "The special exhibition invites visitors on a fascinating journey through time: Austrian furniture design from the postwar reconstruction period."
  }
]
