[
  {
    "source": "japannual",
    "source_id": "japannual-2026",
    "url": "https://www.japannual.at/",
    "title": "Japannual 2026 – 10. Japanische Filmtage in Wien",
    "start": "2026-10-08",
    "end": "2026-10-15",
    "venue": "Filmcasino",
    "district": 1050,
    "city": "Wien",
    "address": "Margaretenstrasse 78, 1050 Wien",
    "price_min": 8.0,
    "price_text": "Preise Einzelticket: € 10,50 (bei Kauf online € 11 ,20) Ermäßigte Tickets: € 9,50 (Ö1-Club, Studierende) ÖJG / Nihonjinkai Mitglieder / Filmcasino Clubkarte: € 8,- Festival Pass: € 85,-",
    "description": "Die 10. Japanischen Filmtage in Wien von 8. bis 15. Oktober 2026 bringen wieder Kino aus Japan nach Wien!"
  }
]
