[
  {
    "source": "wien_gv_sommerkinos",
    "source_id": "dotdotdot",
    "url": "http://www.dotdotdot.at/",
    "title": "dotdotdot Open Air Kurzfilmfestival",
    "start": "2026-09-05",
    "end": "2026-09-22",
    "venue": "Volkskundemuseum Wien",
    "district": 1080,
    "city": "Wien",
    "address": "8., Laudongasse 15-19",
    "category": "Film und Kino",
    "description": "Das dotdotdot bietet abendfüllende Open-Air-Kurzfilmscreenings und Filmtalks bei Dämmerung."
  },
  {
    "source": "wien_gv_sommerkinos",
    "source_id": "rathausplatz",
    "url": "https://filmfestival-rathausplatz.at/",
    "title": "Filmfestival am Rathausplatz",
    "start": "2026-07-04",
    "end": "2026-09-06",
    "district": 1010,
    "city": "Wien",
    "address": "1., Rathausplatz",
    "price_min": 0.0,
    "price_text": "Eintritt frei",
    "category": "Film und Kino",
    "description": "Die 36. Ausgabe von Europas größtem Kultur- und Kulinarik-Festival verbindet Kulinarik mit Musikfilm-Highlights. Filmbeginn ist bei Einbruch der Dunkelheit."
  },
  {
    "source": "wien_gv_sommerkinos",
    "source_id": "frameout",
    "url": "https://frameout.at/home.html",
    "title": "FRAME[O]UT",
    "start": "2026-07-10T21:30",
    "end": "2026-08-29T21:30",
    "district": 1070,
    "city": "Wien",
    "address": "7., Museumsquartier, Hof 8",
    "price_min": 0.0,
    "price_text": "Eintritt frei",
    "category": "Film und Kino",
    "description": "Das Open Air Cinema Festival FRAME[O]UT findet jährlich im Museumsquartier statt."
  },
  {
    "source": "wien_gv_sommerkinos",
    "source_id": "kino-am-dach",
    "url": "http://kinoamdach.at/kino-am-dach/",
    "title": "Kino am Dach",
    "start": "2026-06-01",
    "end": "2026-09-12",
    "venue": "Hauptbücherei",
    "district": 1070,
    "city": "Wien",
    "address": "7., Urban-Loritz-Platz 2a",
    "category": "Film und Kino",
    "description": "Das Kino am Dach geht diesen Sommer in seine 23. Saison und widmet sich unter dem Motto \" MIND GAMES \" dem Spiel mit der Wirklichkeit und dem fragilen Konstrukt von Wahrheit."
  },
  {
    "source": "wien_gv_sommerkinos",
    "source_id": "kino-wie-noch-nie",
    "url": "https://www.filmarchiv.at/de/kino/kino-wie-noch-nie",
    "title": "Kino wie noch nie",
    "start": "2026-06-25",
    "end": "2026-08-30",
    "district": 1020,
    "city": "Wien",
    "address": "2., Augartenspitz/Obere Augartenstraße 1e",
    "category": "Film und Kino",
    "description": "Im Sommer verwandelt sich das Gartenareal des Filmarchivs wieder in eine cineastische und kulinarische Oase. Das Programm besteht aus beliebten Filmklassikern und Neuentdeckungen aus Österreich und der Welt. Filmschaffende werden als Gäste für Publikumsgespräche erwartet."
  },
  {
    "source": "wien_gv_sommerkinos",
    "source_id": "volxkino",
    "url": "https://www.volxkino.at/volxkino-info",
    "title": "VOLXkino - das mobile Filmfestival",
    "start": "2026-06-10",
    "end": "2026-09-19",
    "venue": "an verschiedenen Orten in Wien",
    "city": "Wien",
    "price_min": 0.0,
    "price_text": "Eintritt frei",
    "category": "Film und Kino",
    "description": "Das VOLXkino ist das einzige Wander-Kino seiner Art und schon lange zu einem Fixpunkt im kulturellen Sommer geworden: ein außergewöhnliches Filmprogramm an außergewöhnlichen Orten."
  },
  {
    "source": "wien_gv_sommerkinos",
    "source_id": "stumm-und-laut",
    "url": "https://www.volxkino.at/stumm-und-laut",
    "title": "Stumm & Laut",
    "start": "2026-08-20",
    "end": "2026-08-22",
    "district": 1100,
    "city": "Wien",
    "address": "10., Columbusplatz",
    "price_min": 0.0,
    "price_text": "Eintritt frei",
    "category": "Film und Kino",
    "description": "Beim Filmfest am Columbusplatz spielt es historische Stummfilme mit eigens für den jeweiligen Film arrangierter Live-Musik."
  },
  {
    "source": "wien_gv_sommerkinos",
    "source_id": "sunset-cinema-1",
    "url": "https://www.volxkino.at/sunset-cinema",
    "title": "Sunset Cinema",
    "start": "2026-09-01",
    "end": "2026-09-03",
    "venue": "Weghuberpark",
    "district": 1070,
    "city": "Wien",
    "address": "7., Lerchenfelder Straße 3",
    "price_min": 0.0,
    "price_text": "Eintritt frei",
    "category": "Film und Kino"
  },
  {
    "source": "wien_gv_sommerkinos",
    "source_id": "architektur-film-sommer-1",
    "url": "https://www.azw.at/de/termin/architektur-film-sommer-2026/",
    "title": "Architektur.Film.Sommer",
    "start": "2026-08-12",
    "venue": "Architektur Zentrum Wien, Hof",
    "district": 1070,
    "city": "Wien",
    "address": "7., Museumsplatz 1",
    "price_min": 0.0,
    "price_text": "Eintritt frei",
    "category": "Film und Kino",
    "description": "Die 14. Ausgabe des internationalen Architekturfilmfestivals zeigt im Hof des Architekturzentrum Wien Dokumentar-, Kurz- und Experimentalfilme und lädt Architekturinteressierte wie Cineast*innen zum gemeinsamen Filmscreening und Austausch unter freiem Himmel ein, wobei die Demokratie dieses Jahr im Zentrum steht."
  },
  {
    "source": "wien_gv_sommerkinos",
    "source_id": "architektur-film-sommer-2",
    "url": "https://www.azw.at/de/termin/architektur-film-sommer-2026/",
    "title": "Architektur.Film.Sommer",
    "start": "2026-08-19",
    "venue": "Architektur Zentrum Wien, Hof",
    "district": 1070,
    "city": "Wien",
    "address": "7., Museumsplatz 1",
    "price_min": 0.0,
    "price_text": "Eintritt frei",
    "category": "Film und Kino",
    "description": "Die 14. Ausgabe des internationalen Architekturfilmfestivals zeigt im Hof des Architekturzentrum Wien Dokumentar-, Kurz- und Experimentalfilme und lädt Architekturinteressierte wie Cineast*innen zum gemeinsamen Filmscreening und Austausch unter freiem Himmel ein, wobei die Demokratie dieses Jahr im Zentrum steht."
  },
  {
    "source": "wien_gv_sommerkinos",
    "source_id": "sommerkino-am-markt",
    "url": "https://www.wien.gv.at/veranstaltungen/sommerkino-am-markt",
    "title": "Sommerkino am Markt",
    "start": "2026-07-02",
    "end": "2026-08-27",
    "venue": "verschiedene Märkte in Wien",
    "city": "Wien",
    "price_min": 0.0,
    "price_text": "Eintritt frei",
    "category": "Film und Kino",
    "description": "Das Marktamt und das VOLXKino veranstalten kostenlose Filmvorführungen auf Bauernmarktplätzen der Stadt. Für alle Gäste gibt es vom Marktamt gratis Popcorn direkt aus der Popcorn-Maschine - solange der Vorrat reicht. Gezeigt werden internationale Filmproduktionen und Werke heimischer Regisseur*innen."
  }
]
