[
  {
    "source": "nonstopkino",
    "source_id": "teenage-sex-and-death-at-camp-miasma-preview",
    "url": "https://nonstopkino.at/events/teenage-sex-and-death-at-camp-miasma-preview/",
    "title": "Film Quiz + Teenage Sex and Death at Camp Miasma Preview",
    "start": "2026-08-12",
    "venue": "Atrium-Innenhof bei Kino wie noch nie",
    "city": "Wien",
    "category": "Nur für Mitglieder",
    "description": "Wir laden dich herzlich zu einer Preview des neuen Films von Jane Schoenbrun (I SAW THE TV GLOW) mit Gillian Anderson und Hacks-Star Hannah Einbinder.",
    "status": "scheduled"
  },
  {
    "source": "nonstopkino",
    "source_id": "gentle-monster-preview-mit-qa",
    "url": "https://nonstopkino.at/events/gentle-monster-preview-mit-qa/",
    "title": "Gentle Monster Preview mit Q&A",
    "start": "2026-08-31",
    "venue": "Burg Kino",
    "city": "Wien",
    "category": "Nur für Mitglieder",
    "description": "Der neue Film von Marie Kreutzer (,,Corsage“) – großartig besetzt mit u.a. Léa Seydoux und Jella Haase sowie der Grande Dame des französischen Kinos, Catherine Deneuve, wird bei uns in einer Preview inklusive Gespräch mit Marie Kreutzer gezeigt.",
    "status": "scheduled"
  },
  {
    "source": "nonstopkino",
    "source_id": "lord-of-the-rings-event-2026-09-05",
    "url": "https://nonstopkino.at/events/lord-of-the-rings-event/",
    "title": "Lord of The Rings Event",
    "start": "2026-09-05",
    "venue": "Haydn Kino",
    "city": "Wien",
    "category": "Nur für Mitglieder",
    "description": "Wir zeigen die LORD OF THE RINGS Trilogie in der Extended Version an 3 Tagen im September exklusiv für nonstop Mitglieder.",
    "status": "scheduled"
  },
  {
    "source": "nonstopkino",
    "source_id": "lord-of-the-rings-event-2026-09-11",
    "url": "https://nonstopkino.at/events/lord-of-the-rings-event/",
    "title": "Lord of The Rings Event",
    "start": "2026-09-11",
    "venue": "Haydn Kino",
    "city": "Wien",
    "category": "Nur für Mitglieder",
    "description": "Wir zeigen die LORD OF THE RINGS Trilogie in der Extended Version an 3 Tagen im September exklusiv für nonstop Mitglieder.",
    "status": "scheduled"
  },
  {
    "source": "nonstopkino",
    "source_id": "lord-of-the-rings-event-2026-09-19",
    "url": "https://nonstopkino.at/events/lord-of-the-rings-event/",
    "title": "Lord of The Rings Event",
    "start": "2026-09-19",
    "venue": "Haydn Kino",
    "city": "Wien",
    "category": "Nur für Mitglieder",
    "description": "Wir zeigen die LORD OF THE RINGS Trilogie in der Extended Version an 3 Tagen im September exklusiv für nonstop Mitglieder.",
    "status": "scheduled"
  },
  {
    "source": "nonstopkino",
    "source_id": "bruno-der-junge-kreisky-preview-mit-qa",
    "url": "https://nonstopkino.at/events/bruno-der-junge-kreisky-preview-mit-qa/",
    "title": "Bruno - Der junge Kreisky Preview mit Q&A",
    "start": "2026-09-15",
    "venue": "Filmcasino",
    "city": "Wien",
    "category": "Nur für Mitglieder",
    "status": "scheduled"
  },
  {
    "source": "nonstopkino",
    "source_id": "viennale-sneak-preview-2",
    "url": "https://nonstopkino.at/events/viennale-sneak-preview-2/",
    "title": "Viennale Sneak Preview",
    "start": "2026-10-16",
    "venue": "Stadtkino",
    "city": "Wien",
    "category": "Nur für Mitglieder",
    "description": "Auch 2026 wird es wieder einen Film aus dem Programm der diesjährigen Viennale geben, den wir vorab zeigen werden.",
    "status": "scheduled"
  },
  {
    "source": "nonstopkino",
    "source_id": "die-blutgraefin",
    "url": "https://nonstopkino.at/events/die-blutgraefin/",
    "title": "Die Blutgräfin",
    "start": "2026-10-31",
    "venue": "Bellaria Kino",
    "city": "Wien",
    "category": "Nur für Mitglieder",
    "description": "Zu Halloween laden wir euch herzlich zu einem Special im Bellaria Kino ein.",
    "status": "scheduled"
  }
]
