[
  {
    "source": "wu",
    "source_id": "35047",
    "url": "https://www.wu.ac.at/ausstellung/",
    "title": "Ausstellung \"Bilder von Morgen\"",
    "start": "2026-05-04T10:00",
    "end": "2026-10-10T10:00",
    "venue": "Wirtschaftsuniversität Wien, Departments 1",
    "city": "Wien",
    "category": "Feste und Ehrungen",
    "description": "30 Menschen – eine Botschaft!"
  },
  {
    "source": "wu",
    "source_id": "35813",
    "url": "https://www.wu.ac.at/universitaet/news-und-events/events/detail/welcome-days-2026",
    "title": "Welcome Days 2026",
    "start": "2026-09-01T09:00",
    "end": "2026-09-03T15:00",
    "venue": "Wirtschaftsuniversität Wien, Library & Learning Center",
    "city": "Wien",
    "category": "Rund ums Studium",
    "description": "Herzlich willkommen in der WU Community! Eure Studienreise beginnt jetzt – bei den Welcome Days"
  },
  {
    "source": "wu",
    "source_id": "35731",
    "url": "https://www.wu.ac.at/universitaet/news-und-events/events",
    "title": "Get ready for winter term – SSC Beratungsevent",
    "start": "2026-09-09T13:00",
    "end": "2026-09-09T16:00",
    "venue": "Vor Ort",
    "city": "Wien"
  },
  {
    "source": "wu",
    "source_id": "34665",
    "url": "https://www.wu.ac.at/universitaet/news-und-events/events",
    "title": "JUS+ Kick-Off",
    "start": "2026-09-16T09:30",
    "end": "2026-09-16T16:00",
    "venue": "Wirtschaftsuniversität Wien, Library & Learning Center",
    "city": "Wien",
    "category": "Rund ums Studium",
    "description": "Am 16. September 2026 findet unser JUS+ Kick-Off statt."
  },
  {
    "source": "wu",
    "source_id": "35814",
    "url": "https://www.wu.ac.at/en/students/my-program/bachelors-programs/business-and-economics/bbe-welcome-days-2026/",
    "title": "BBE Welcome Days",
    "start": "2026-09-21T08:00",
    "end": "2026-09-22T12:00",
    "venue": "Vor Ort, Library & Learning Center",
    "city": "Wien",
    "category": "Rund ums Studium",
    "description": "Meet your fellow students, explore the WU Campus and learn everything you need to know about the BBE program."
  },
  {
    "source": "wu",
    "source_id": "32485",
    "url": "https://www.wu.ac.at/universitaet/organisation/dienstleistungseinrichtungen/marketing-kommunikation/wu-masters-week/",
    "title": "WU Master's Week",
    "start": "2026-09-28T09:00",
    "end": "2026-10-02T19:00",
    "venue": "Online",
    "city": "Wien",
    "category": "Rund ums Studium",
    "description": "Lerne unsere Masterprogramme Online via MS Teams kennen."
  },
  {
    "source": "wu",
    "source_id": "34657",
    "url": "https://www.verkehrsrechtstag.at/",
    "title": "ZVR-Verkehrsrechtstag",
    "start": "2026-10-01T09:15",
    "end": "2026-10-01T16:00",
    "venue": "Wirtschaftsuniversität Wien, Library & Learning Center",
    "city": "Wien",
    "category": "Forschung und Konferenzen; Podiumsdiskussionen und Vorträge",
    "description": "Der 19. ZVR-Verkehrsrechtstag wird am 01.10.2026 stattfinden."
  },
  {
    "source": "wu",
    "source_id": "35799",
    "url": "https://executiveacademy.at/events/online-infosession-ll-m-recht-fuer-fuehrungskraefte#llm-recht-fur-fuhrungskrafte-erfahren-sie-alles-uber-das-programm-vom-akademischen-leiter-prof-georg-kodek-0e381ff5",
    "title": "Online-Infosession LL.M. Recht für Führungskräfte",
    "start": "2026-10-14T17:30",
    "end": "2026-10-14T18:30",
    "venue": "Online",
    "city": "Wien",
    "category": "Rund ums Studium",
    "description": "Sichern Sie sich Ihren Platz im begehrten LL.M. Programm mit Prof. Georg Kodek – Start ab Oktober 2027!"
  }
]
