[
  {
    "source": "admiralkino",
    "source_id": "paris-murder-mystery-1788204600",
    "url": "https://www.admiralkino.at/produktion/paris-murder-mystery/",
    "title": "PARIS MURDER MYSTERY",
    "start": "2026-08-31T19:30",
    "venue": "Admiral Kino",
    "district": 1070,
    "city": "Wien",
    "address": "Burggasse 119, 1070 Wien",
    "category": "Krimi",
    "description": "Needles and Crime / DF",
    "status": "scheduled"
  },
  {
    "source": "admiralkino",
    "source_id": "wholetrain-1788553800",
    "url": "https://www.admiralkino.at/produktion/wholetrain/",
    "title": "Wholetrain",
    "start": "2026-09-04T20:30",
    "venue": "Admiral Kino",
    "district": 1070,
    "city": "Wien",
    "address": "Burggasse 119, 1070 Wien",
    "category": "Drama",
    "description": "Film & Gespräch / dt. OV",
    "status": "scheduled"
  },
  {
    "source": "admiralkino",
    "source_id": "ich-will-alles-hildegard-knef-1789902000",
    "url": "https://www.admiralkino.at/produktion/ich-will-alles-hildegard-knef/",
    "title": "Ich will alles. Hildegard Knef",
    "start": "2026-09-20T11:00",
    "venue": "Admiral Kino",
    "district": 1070,
    "city": "Wien",
    "address": "Burggasse 119, 1070 Wien",
    "category": "Dokumentarfilm",
    "description": "dt. OV",
    "status": "scheduled"
  },
  {
    "source": "admiralkino",
    "source_id": "rebellinnen-1791489600",
    "url": "https://www.admiralkino.at/produktion/rebellinnen/",
    "title": "Rebellinnen – Fotografie. Underground. DDR.",
    "start": "2026-10-08T20:00",
    "venue": "Admiral Kino",
    "district": 1070,
    "city": "Wien",
    "address": "Burggasse 119, 1070 Wien",
    "description": "STILL/MOVING / dt. OV",
    "status": "scheduled"
  },
  {
    "source": "admiralkino",
    "source_id": "aufputzt-is-1795345200",
    "url": "https://www.admiralkino.at/produktion/aufputzt-is/",
    "title": "Aufputzt is’",
    "start": "2026-11-22T11:00",
    "venue": "Admiral Kino",
    "district": 1070,
    "city": "Wien",
    "address": "Burggasse 119, 1070 Wien",
    "category": "Komödie",
    "description": "dt. OV",
    "status": "scheduled"
  },
  {
    "source": "admiralkino",
    "source_id": "chronicle-1797537600",
    "url": "https://www.admiralkino.at/produktion/chronicle/",
    "title": "CHRONICLE",
    "start": "2026-12-17T20:00",
    "venue": "Admiral Kino",
    "district": 1070,
    "city": "Wien",
    "address": "Burggasse 119, 1070 Wien",
    "description": "STILL//MOVING / OmenglU",
    "status": "scheduled"
  },
  {
    "source": "admiralkino",
    "source_id": "kino-schenken-1798142400",
    "url": "https://www.admiralkino.at/produktion/kino-schenken/",
    "title": "KINO SCHENKEN",
    "start": "2026-12-24T20:00",
    "venue": "Admiral Kino",
    "district": 1070,
    "city": "Wien",
    "address": "Burggasse 119, 1070 Wien",
    "category": "Merch",
    "status": "scheduled"
  }
]
