[
  {
    "source": "technischesmuseum",
    "source_id": "innovation_corner",
    "url": "https://www.technischesmuseum.at/ausstellung/innovation_corner",
    "title": "Innovation Corner: POWER ON",
    "start": "2026-02-10",
    "end": "2026-08-16",
    "venue": "Technisches Museum Wien",
    "district": 1140,
    "city": "Wien",
    "address": "Mariahilfer Straße 212, 1140 Wien",
    "description": "An welchen technischen Innovationen wird derzeit gearbeitet? Welche Ideen und Erfindungen aus Österreich können unsere Welt verändern? Die neue Ausstellungsserie zeigt aktuelle Entwicklungen am Puls der Zeit."
  },
  {
    "source": "technischesmuseum",
    "source_id": "klima_wissen_handeln",
    "url": "https://www.technischesmuseum.at/ausstellung/klima_wissen_handeln",
    "title": "Klima. Wissen. Handeln!",
    "start": "2024-03-13",
    "venue": "Technisches Museum Wien",
    "district": 1140,
    "city": "Wien",
    "address": "Mariahilfer Straße 212, 1140 Wien",
    "description": "Der Klimawandel stellt eine große Herausforderung für unsere Umwelt und unsere Gesellschaft dar. Aber mit dem heutigen Wissen ist es möglich, der Klimakrise entgegenzutreten, um eine lebenswerte Zukunft für alle zu ermöglichen. Die Ausstellung verknüpft Fakten mit eindrucksvollen Satellitenbildern und zeigt an interaktiven Stationen den gegenwärtigen Zustand der Umwelt und vor allem unsere Handlungsmöglichkeiten im Kleinen und Großen auf.",
    "extra": {
      "permanent": true
    }
  },
  {
    "source": "technischesmuseum",
    "source_id": "materialwelten",
    "url": "https://www.technischesmuseum.at/ausstellung/materialwelten",
    "title": "Materialwelten",
    "start": "2025-04-09",
    "venue": "Technisches Museum Wien",
    "district": 1140,
    "city": "Wien",
    "address": "Mariahilfer Straße 212, 1140 Wien",
    "description": "Ob Holz, Glas, Beton, Silizium oder Gummi – jedes Material, das uns im Alltag begegnet, erzählt eine Geschichte: von Ressourcen und Rohstoffen, von Handwerk und Hochtechnologie, von Gesellschaft und Entwicklung. Die Ausstellung Materialwelten im Technischen Museum Wien widmet sich genau diesen Geschichten – und lädt ein zu einer spannenden Reise durch Vergangenheit, Gegenwart und Zukunft unserer Werkstoffe.",
    "extra": {
      "permanent": true
    }
  },
  {
    "source": "technischesmuseum",
    "source_id": "minixplore",
    "url": "https://www.technischesmuseum.at/ausstellung/minixplore",
    "title": "miniXplore",
    "start": "2021-03-12",
    "venue": "Technisches Museum Wien",
    "district": 1140,
    "city": "Wien",
    "address": "Mariahilfer Straße 212, 1140 Wien",
    "description": "Die neue Erlebnis-Ausstellung für Familien mit Kindern von 3–8 Jahren weckt Experimentierfreude und Bewegungsdrang, denn in der vielfältigen und künstlerischen Bewegungslandschaft warten zahlreiche Stationen auf neugierige Forscher:innen!",
    "extra": {
      "permanent": true
    }
  },
  {
    "source": "technischesmuseum",
    "source_id": "minti",
    "url": "https://www.technischesmuseum.at/ausstellung/minti",
    "title": "minTi",
    "start": "2023-10-20",
    "venue": "Technisches Museum Wien",
    "district": 1140,
    "city": "Wien",
    "address": "Mariahilfer Straße 212, 1140 Wien",
    "description": "Der Erlebnisbereich für Familien mit Kindern von 1,5–5 Jahren gibt kleinen Entdecker:innen viel Raum für Bewegung und spielerische Erfahrungen und fördert die Explorationsfreude der jüngsten Besucher:innen.",
    "extra": {
      "permanent": true
    }
  },
  {
    "source": "technischesmuseum",
    "source_id": "mobilitaet",
    "url": "https://www.technischesmuseum.at/ausstellung/mobilitaet",
    "title": "Mobilität",
    "start": "2020-11-06",
    "venue": "Technisches Museum Wien",
    "district": 1140,
    "city": "Wien",
    "address": "Mariahilfer Straße 212, 1140 Wien",
    "description": "Brauchen wir eine Verkehrswende? Wer hat nun eigentlich das Auto erfunden? Und was ist so bemerkenswert an der Donau – als Fluss, Wasserstraße und Lebensraum? Die Dauerausstellung „Mobilität“ stellt diese und viele weitere Fragen. Auf 3.000 m 2 werden rund 800 Exponate zu Lande, zu Wasser und in der Luft präsentiert.",
    "extra": {
      "permanent": true
    }
  },
  {
    "source": "technischesmuseum",
    "source_id": "more_than_recycling",
    "url": "https://www.technischesmuseum.at/ausstellung/more_than_recycling",
    "title": "More than Recycling",
    "start": "2025-06-18",
    "end": "2027-02-07",
    "venue": "Technisches Museum Wien",
    "district": 1140,
    "city": "Wien",
    "address": "Mariahilfer Straße 212, 1140 Wien",
    "description": "Wegwerfen war gestern. Oder doch nicht? Was lange Zeit selbstverständlich war – Ressourcen optimal und solange wie möglich zu nutzen – scheint heute vergessen. „More than Recycling“ lädt dazu ein, unseren Umgang mit Dingen neu zu denken."
  },
  {
    "source": "technischesmuseum",
    "source_id": "techlab",
    "url": "https://www.technischesmuseum.at/ausstellung/techlab",
    "title": "techLAB",
    "start": "2020-10-01",
    "venue": "Technisches Museum Wien",
    "district": 1140,
    "city": "Wien",
    "address": "Mariahilfer Straße 212, 1140 Wien",
    "description": "Mit dem Laser gravieren, 3D-drucken, Computerspiele programmieren – zu kompliziert für dich? Sicher nicht!",
    "extra": {
      "permanent": true
    }
  },
  {
    "source": "technischesmuseum",
    "source_id": "wissenschaft_im_wandel",
    "url": "https://www.technischesmuseum.at/ausstellung/wissenschaft_im_wandel",
    "title": "Wissenschaft im Wandel",
    "start": "2026-04-23",
    "venue": "Technisches Museum Wien",
    "district": 1140,
    "city": "Wien",
    "address": "Mariahilfer Straße 212, 1140 Wien",
    "description": "Woher kommt unser Wissen? Woran wird geforscht und warum? Mit der neuen Dauerausstellung begibt sich das TMW gemeinsam mit den Besucher:innen auf Spurensuche und zeigt dabei, wie Wissen entsteht – und sich im Laufe der Zeit verändert.",
    "extra": {
      "permanent": true
    }
  }
]
