[
  {
    "source": "echoraum",
    "source_id": "6698",
    "url": "https://echoraum.at/vernissage-susanna-gartmayer-speicher/",
    "title": "Vernissage Susanna Gartmayer: SPEICHER",
    "start": "2026-09-10T19:00",
    "venue": "echoraum",
    "district": 1150,
    "city": "Wien",
    "address": "Sechshauser Straße 66, 1150 Wien",
    "category": "ausstellung, konzert",
    "description": "Susanna Gartmayer solo · rescale ensemble : Christine Gnigler (Stimme, Blockflöte) / Thomas Grimm (Altsaxophon) / Susanna Gartmayer (Bassklarinette) / Markus W. Schneider (E-Gitarre) / Johannes Wakolbinger (Komposition) · Vernissage Susanna Gartmayer: SPEICHER",
    "status": "scheduled"
  },
  {
    "source": "echoraum",
    "source_id": "6701",
    "url": "https://echoraum.at/collins-uhler-%c2%b7-carrasco-vergara/",
    "title": "Collins & Ulher · Carrasco & Vergara",
    "start": "2026-09-15T20:00",
    "venue": "echoraum",
    "district": 1150,
    "city": "Wien",
    "address": "Sechshauser Straße 66, 1150 Wien",
    "category": "konzert",
    "description": "Nicolas Collins (!Trompete) & Birgit Ulher (Trompete!) · Edén Carrasco (Altsaxophon) & Benjamin Vergara (Trompete)",
    "status": "scheduled"
  },
  {
    "source": "echoraum",
    "source_id": "6703",
    "url": "https://echoraum.at/anais-tuerlinckx-%c2%b7-warelis-stoffner-fischerlehrer/",
    "title": "Anaïs Tuerlinckx · Warelis / Stoffner / Fischerlehrer",
    "start": "2026-09-19T20:00",
    "venue": "echoraum",
    "district": 1150,
    "city": "Wien",
    "address": "Sechshauser Straße 66, 1150 Wien",
    "category": "konzert",
    "description": "Anaïs Tuerlinckx solo (Innenklavier) · Marta Warelis (Klavier) / Florian Stoffner (E-Gitarre) / Rudi Fischerlehner (Perkussion, Schlagzeug)",
    "status": "scheduled"
  },
  {
    "source": "echoraum",
    "source_id": "6705",
    "url": "https://echoraum.at/velak-gala-146/",
    "title": "velak-gala #146",
    "start": "2026-09-22T19:00",
    "venue": "echoraum",
    "district": 1150,
    "city": "Wien",
    "address": "Sechshauser Straße 66, 1150 Wien",
    "category": "konzert, reihe",
    "description": "mit La Cuerda y el Grito ( Yuko Cornale & Sofía Escamilla ) · ErikM solo · Sajjra Xhrs Galarreta",
    "status": "scheduled"
  },
  {
    "source": "echoraum",
    "source_id": "6707",
    "url": "https://echoraum.at/kaplan-valencia-%c2%b7-huebsch-aber-verstrahlt/",
    "title": "Kaplan & Valencia · Hübsch aber verstrahlt",
    "start": "2026-09-25T20:00",
    "venue": "echoraum",
    "district": 1150,
    "city": "Wien",
    "address": "Sechshauser Straße 66, 1150 Wien",
    "category": "konzert",
    "description": "María Valencia (Altsaxophon, Klarinette) & Leonel Kaplan (Kornett, Trompete) · Silke Strahl (Saxophon, Stimme) & Carl Ludwig Hübsch (Tuba, Stimme)",
    "status": "scheduled"
  },
  {
    "source": "echoraum",
    "source_id": "6709",
    "url": "https://echoraum.at/into-the-wide/",
    "title": "Into the wide",
    "start": "2026-09-29T20:00",
    "venue": "echoraum",
    "district": 1150,
    "city": "Wien",
    "address": "Sechshauser Straße 66, 1150 Wien",
    "category": "konzert",
    "description": "Thomas Berghammer (Trompete) / Gunter Schneider (Gitarre) / Gerhard Laber (Perkussion)",
    "status": "scheduled"
  },
  {
    "source": "echoraum",
    "source_id": "6838",
    "url": "https://echoraum.at/nachhall-18-every-song-ever-iii/",
    "title": "Nachhall #18: Every Song Ever III",
    "start": "2026-10-07T20:00",
    "venue": "echoraum",
    "district": 1150,
    "city": "Wien",
    "address": "Sechshauser Straße 66, 1150 Wien",
    "description": "Paul Wallfisch (Tasten, Stimme, Elektronik) / Martin Siewert (Gitarren, Lap Steel, Elektronik) / Emily Stewart (Stimme, Violine)",
    "status": "scheduled"
  },
  {
    "source": "echoraum",
    "source_id": "6711",
    "url": "https://echoraum.at/mivos-quartet/",
    "title": "Mivos Quartet",
    "start": "2026-10-10T20:00",
    "venue": "echoraum",
    "district": 1150,
    "city": "Wien",
    "address": "Sechshauser Straße 66, 1150 Wien",
    "category": "konzert",
    "description": "Morton Feldman – Piano and String Quartet (1985) · Olivia De Prato (Violine) / William Overcash (Violine) / Victor Lowrie Tafoya (Viola) / Nathan Watts (Cello) / Vicky Chow (Klavier)",
    "status": "scheduled"
  },
  {
    "source": "echoraum",
    "source_id": "6718",
    "url": "https://echoraum.at/snim-dauerpraesent-sendebereit-reichweite-erschoepft/",
    "title": "snim: dauerpräsent. sendebereit. reichweite erschöpft.",
    "start": "2026-10-14T20:00",
    "venue": "echoraum",
    "district": 1150,
    "city": "Wien",
    "address": "Sechshauser Straße 66, 1150 Wien",
    "category": "konzert",
    "description": "Gloria Damijan (Klavier, Toy Piano) / Reni Weichselbaum (Blockflöten) / Bernhard Schöberl (Gitarren) / Michael Zacherl (Scivolo) / Judith Unterpertinger (Komposition)",
    "status": "scheduled"
  },
  {
    "source": "echoraum",
    "source_id": "6721",
    "url": "https://echoraum.at/voutchkova-kravanja-canna-solo-duo-trio/",
    "title": "Voutchkova / Kravanja / Canna: SOLO, DUO, TRIO",
    "start": "2026-10-16T20:00",
    "venue": "echoraum",
    "district": 1150,
    "city": "Wien",
    "address": "Sechshauser Straße 66, 1150 Wien",
    "category": "konzert",
    "description": "Biliana Voutchkova (Geige, Stimme) / Ana Kravanja (Geige, Stimme) / Thomas Canna (Perkussion)",
    "status": "scheduled"
  },
  {
    "source": "echoraum",
    "source_id": "6737",
    "url": "https://echoraum.at/schallfeld-text-im-klang-7/",
    "title": "Schallfeld Ensemble: Text im Klang #7",
    "start": "2026-10-20T20:00",
    "venue": "echoraum",
    "district": 1150,
    "city": "Wien",
    "address": "Sechshauser Straße 66, 1150 Wien",
    "category": "konzert",
    "description": "Zinajda Kodrič (Flöte) · Arnold Plankensteiner (Klarinette) · Patrick Skrilecz (Klavier) · Lorenzo Derinni (Violine) · Myriam García Fidalgo (Cello) · Klaus Kastberger (Einführung zum Schaffen von Friederike Mayröcker)",
    "status": "scheduled"
  },
  {
    "source": "echoraum",
    "source_id": "6745",
    "url": "https://echoraum.at/der-betrieb-x-echoraum-3/",
    "title": "Der Betrieb × echoraum #3",
    "start": "2026-10-23T18:00",
    "venue": "echoraum",
    "district": 1150,
    "city": "Wien",
    "address": "Sechshauser Straße 66, 1150 Wien",
    "category": "konzert, performance, reihe",
    "description": "18:00 Uhr: Soundwalk mit Tim Shaw (Treffpunkt: Der Betrieb, Vogelweideplatz 13, 1150 Wien) · 20:00 Uhr: Tim Shaw (DIY Elektronik, gefundene Objekte) · Magdalena Forster (Performance)",
    "status": "scheduled"
  },
  {
    "source": "echoraum",
    "source_id": "6756",
    "url": "https://echoraum.at/milla-gordoa-malfon-trio/",
    "title": "Millà · Gordoa · Malfon Trio",
    "start": "2026-10-27T19:00",
    "venue": "echoraum",
    "district": 1150,
    "city": "Wien",
    "address": "Sechshauser Straße 66, 1150 Wien",
    "category": "konzert",
    "description": "Jordina Millà (Klavier) / Emilio Gordoa (Vibraphon, Perkussion) / Don Malfon (Saxophon) · Finissage Susanna Gartmayer: SPEICHER",
    "status": "scheduled"
  },
  {
    "source": "echoraum",
    "source_id": "6764",
    "url": "https://echoraum.at/noche-de-werner-2/",
    "title": "noche de Werner",
    "start": "2026-10-30T18:00",
    "venue": "echoraum",
    "district": 1150,
    "city": "Wien",
    "address": "Sechshauser Straße 66, 1150 Wien",
    "category": "konzert, reihe",
    "description": "mit Franz Hautzinger (Trompete) & Achim Tang (Kontrabass) · deepseafish-k: Katharina Klement / Manon Liu Winter / Juun (HorizontalSaitenInstrumente)",
    "status": "scheduled"
  }
]
