[
  {
    "source": "kindermuseum",
    "source_id": "1757370821789-2026-10-28T10:00",
    "url": "https://www.kindermuseum.at/zoom_programmangebot/zoom_atelier/atelier-abos",
    "title": "Kunstwerkstatt Herbst 2026",
    "start": "2026-10-28T10:00",
    "venue": "ZOOM Kindermuseum",
    "district": 1070,
    "city": "Wien",
    "address": "Museumsplatz 1, 1070 Wien",
    "price_min": 0.0,
    "price_text": "Eintritt frei",
    "category": "Atelier",
    "description": "TERMINE : 28. Oktober 10.00 Uhr 29. Oktober 10.00 Uhr DAUER: 2 Stunden pro Termin Alter Für Kinder von 6 bis 10 Jahren Preis Eintritt frei! Reservierung: office@kindermuseum.at Reservierung erforderlich!",
    "status": "scheduled"
  },
  {
    "source": "kindermuseum",
    "source_id": "1757370821789-2026-10-29T10:00",
    "url": "https://www.kindermuseum.at/zoom_programmangebot/zoom_atelier/atelier-abos",
    "title": "Kunstwerkstatt Herbst 2026",
    "start": "2026-10-29T10:00",
    "venue": "ZOOM Kindermuseum",
    "district": 1070,
    "city": "Wien",
    "address": "Museumsplatz 1, 1070 Wien",
    "price_min": 0.0,
    "price_text": "Eintritt frei",
    "category": "Atelier",
    "description": "TERMINE : 28. Oktober 10.00 Uhr 29. Oktober 10.00 Uhr DAUER: 2 Stunden pro Termin Alter Für Kinder von 6 bis 10 Jahren Preis Eintritt frei! Reservierung: office@kindermuseum.at Reservierung erforderlich!",
    "status": "scheduled"
  },
  {
    "source": "kindermuseum",
    "source_id": "1373442330421",
    "url": "https://www.kindermuseum.at/zoom_programmangebot/zoom_ozean",
    "title": "ZOOM Ozean",
    "start": "2026-08-08",
    "venue": "ZOOM Kindermuseum",
    "district": 1070,
    "city": "Wien",
    "address": "Museumsplatz 1, 1070 Wien",
    "price_min": 6.5,
    "price_text": "€ 6,50",
    "category": "Ozean",
    "description": "Für Privatbesucher*innen und Kindergartengruppen ZOOM Ozean Der bunte und vielfältige Erfahrungs- und Spielort für Kinder im Alter von 0 bis 6 Jahren Alter Für Kinder von 0 bis 6 Jahren Beginnzeiten Für Kinder von 0 - 6 Jahren: Di. - Do.: 10:15, 11:30, 12:45 Fr. - So.: 11:00, 12:15, 14:30, 15:45 Für Kinder von 0 - 3 Jahren: Fr. - So.: 9:45 Termine für ältere Geschwister: Fr. - So.: 17:00 Beim Geschwistertermin können ältere Geschwister (über 6 Jahre) mit ihren jüngeren Geschwistern gemeinsam den Ozean besuchen. Dauer: 60 Minuten Preis Für Privatbesucher*innen ab 8 Monaten: € 6,50 pro Person Ki",
    "status": "scheduled",
    "extra": {
      "permanent": true
    }
  },
  {
    "source": "kindermuseum",
    "source_id": "1756989105805",
    "url": "https://www.kindermuseum.at/zoom_programmangebot/zoom_trickfilmstudio",
    "title": "KI – KINDER-INTELLIGENZ!",
    "start": "2026-08-08",
    "venue": "ZOOM Kindermuseum",
    "district": 1070,
    "city": "Wien",
    "address": "Museumsplatz 1, 1070 Wien",
    "price_min": 8.5,
    "price_text": "€ 8,50",
    "category": "Trickfilmstudio",
    "description": "KI – KINDER-INTELLIGENZ! **NUR NOCH BIS 6. SEPTEMBER** Lasst euch gemeinsam zu ungewohnten Gedankengängen inspirieren und kreiert als Kinder-Intelligenz-Team neue Abenteuer! Alter Für Kinder von 9 bis 14 Jahren (3. - 8. Schulstufe) Beginnzeiten Privatpersonen Mi: 10:30, 12:30 Fr. - So.: 10:00, 12:00 Dauer: 90 Minuten Preis Privatbesucher*innen € 8,50 pro Person Institutionen bis 10 Kinder € 8,50 (1,5 Std.) / € 17,- (3,5 Std.) / pro Kind ab 10 Kinder € 7,- (1,5 Std.) / € 14,- (3,5 Std.) / pro Kind Dabei verknüpft ihr eure Fantasien zu außergewöhnlichen Geschichten und löst kuriose Probleme, für",
    "status": "scheduled",
    "extra": {
      "permanent": true
    }
  },
  {
    "source": "kindermuseum",
    "source_id": "1725606733930",
    "url": "https://www.kindermuseum.at/wiener_kindervorlesungen",
    "title": "ZOOM Fragwürdig? (vorm. Kindervorlesungen)",
    "start": "2026-08-08",
    "venue": "ZOOM Kindermuseum",
    "district": 1070,
    "city": "Wien",
    "address": "Museumsplatz 1, 1070 Wien",
    "price_min": 6.5,
    "price_text": "EUR 6,50",
    "category": "Fragwürdig? (vorm. Kindervorlesungen)",
    "description": "Für Kinder von 8 bis 12 Jahren ZOOM Fragwürdig? (vorm. Kindervorlesungen) Vermittlung von Wissenschaft an Kinder Neugier ist sowohl für Kinder als auch für Wissenschaftler*innen der wichtigste Antrieb, um zu lernen. Seit 2003 begeistert ZOOM Fragwürdig? (vorm. \"Kindervorlesungen\") Besucher*innen ab 8 Jahren für unterschiedliche Forschungsbereiche. Renommierte österreichische und internationale Wissenschaftler*innen behandeln Themen, die Kinder besonders interessieren. Das junge Publikum darf und soll Fragen stellen und die Vortragenden herausfordern! Dabei erleben die Kinder, wie viel Spaß Wis",
    "status": "scheduled",
    "extra": {
      "permanent": true
    }
  }
]
